{
  "$schema": "http://json-schema.org/draft-07/schema#",
  "title": "Backhaul machine config",
  "description": "Per-machine, gitignored config (config.local.json) telling Backhaul where content roots live on this machine and which optional modules are enabled. See migration/MIGRATION_PLAN.md §6.",
  "type": "object",
  "required": ["version", "content_roots"],
  "properties": {
    "version": {
      "type": "string",
      "description": "This config file's schema version — must exactly match foundation/config.py's CONFIG_SCHEMA_VERSION for this checkout (currently \"0.1.0\"), or load_config() refuses to load it. Bumped only on a breaking config shape change (required key added/renamed/removed), not on every package release — adding a new optional key like content_roots.roadmap does not require bumping this."
    },
    "project_name": {
      "type": "string",
      "description": "Display name shown in every piece of Backhaul content's normalized header (e.g. \"mcRepos\", \"LunaFlow_A\"). Optional — falls back to content_roots.tickets's grandparent folder name when omitted."
    },
    "content_roots": {
      "type": "object",
      "description": "Paths to this machine's actual ticket/wiki content, outside the repo.",
      "properties": {
        "tickets": { "type": "string" },
        "wiki": { "type": "string" },
        "roadmap": { "type": "string", "description": "Optional — only needed if \"roadmap\" is in enabled_modules. One folder per project; individual graphs are scoped within it by client UID prefix (RM_<uid>_NNN.md), not by subfolder." },
        "roles": { "type": "string", "description": "Optional — only needed if \"roles\" is in enabled_modules. One folder per project holding that project's agent-role pages (see modules/roles)." }
      },
      "required": ["tickets", "wiki"]
    },
    "enabled_modules": {
      "type": "array",
      "description": "Optional module ids to enable (e.g. \"docx\", \"shortcuts\", \"handlers.editmd\", \"handlers.openfolder\"). BHT/BHW are always on and not listed here.",
      "items": { "type": "string" }
    },
    "client_folders": {
      "type": "object",
      "description": "Per-client UID -> project folder path (e.g. \"UW\": \"C:\\\\Projects\\\\University of Washington\"), used by the ticket header's Folder link (opened via the openfolder: protocol handler). A client UID with no entry here falls back to content_roots.tickets's parent directory.",
      "additionalProperties": { "type": "string" }
    }
  }
}
