{
  "version": "0.1.0",
  "project_name": "THIS PROJECT'S DISPLAY NAME",
  "content_roots": {
    "tickets": "PATH/TO/THIS/PROJECT/backhaul/tickets",
    "wiki": "PATH/TO/THIS/PROJECT/backhaul/wiki"
  },
  "enabled_modules": [],
  "client_folders": {
    "EXAMPLE_UID": "PATH/TO/THAT/CLIENT/PROJECT/FOLDER"
  }
}
